{
  "$schema": "https://json-schema.org/draft/2020-12/schema",
  "$id": "https://vaixlns.org/schemas/gedf-research-capsule.v1.schema.json",
  "title": "GEDF Research Capsule",
  "type": "object",
  "additionalProperties": false,
  "required": [
    "schema",
    "mission_id",
    "research_question",
    "domains",
    "sources",
    "claims",
    "hypotheses"
  ],
  "properties": {
    "schema": {
      "const": "vaixl.gedf.research-capsule.v1"
    },
    "mission_id": {
      "type": "string",
      "minLength": 1
    },
    "research_question": {
      "type": "string",
      "minLength": 1
    },
    "domains": {
      "type": "array",
      "minItems": 4,
      "uniqueItems": true,
      "items": {
        "type": "string"
      }
    },
    "sources": {
      "type": "array",
      "minItems": 1,
      "items": {
        "type": "object",
        "additionalProperties": false,
        "required": [
          "source_id",
          "url",
          "source_type",
          "evidence_level",
          "captured_text",
          "captured_text_sha256",
          "retrieved_at_utc"
        ],
        "properties": {
          "source_id": {
            "type": "string",
            "minLength": 1
          },
          "url": {
            "type": "string",
            "format": "uri",
            "pattern": "^https://"
          },
          "source_type": {
            "enum": [
              "PAPER",
              "REPOSITORY",
              "STANDARD",
              "OFFICIAL_DOCS",
              "BENCHMARK",
              "DATASET"
            ]
          },
          "evidence_level": {
            "enum": [
              "ABSTRACT_ONLY",
              "FULL_TEXT_REVIEWED",
              "SOURCE_CODE_INSPECTED",
              "TEST_EXECUTED",
              "MEASURED"
            ]
          },
          "captured_text": {
            "type": "string"
          },
          "captured_text_sha256": {
            "type": "string",
            "pattern": "^[a-f0-9]{64}$"
          },
          "retrieved_at_utc": {
            "type": "string",
            "minLength": 1
          }
        }
      }
    },
    "claims": {
      "type": "array",
      "minItems": 1,
      "items": {
        "type": "object",
        "additionalProperties": false,
        "required": [
          "claim_id",
          "statement",
          "source_ids",
          "epistemic_state",
          "independent_confirmation"
        ],
        "properties": {
          "claim_id": {
            "type": "string",
            "minLength": 1
          },
          "statement": {
            "type": "string",
            "minLength": 1
          },
          "source_ids": {
            "type": "array",
            "minItems": 1,
            "items": {
              "type": "string"
            }
          },
          "epistemic_state": {
            "enum": [
              "OBSERVATION",
              "SOURCE_ASSERTION",
              "INFERENCE",
              "HYPOTHESIS",
              "COUNTEREVIDENCE"
            ]
          },
          "independent_confirmation": {
            "type": [
              "boolean",
              "null"
            ]
          }
        }
      }
    },
    "hypotheses": {
      "type": "array",
      "minItems": 1,
      "items": {
        "type": "object",
        "additionalProperties": false,
        "required": [
          "hypothesis_id",
          "mechanism",
          "falsification_method",
          "baseline_comparison",
          "alternatives"
        ],
        "properties": {
          "hypothesis_id": {
            "type": "string",
            "minLength": 1
          },
          "mechanism": {
            "type": "string",
            "minLength": 1
          },
          "falsification_method": {
            "type": "string",
            "minLength": 1
          },
          "baseline_comparison": {
            "type": "string",
            "minLength": 1
          },
          "alternatives": {
            "type": "array",
            "minItems": 1,
            "items": {
              "type": "string",
              "minLength": 1
            }
          }
        }
      }
    }
  }
}
